{"schema_version":"2.0.0","finding_id":"FND-C05-001","assessment_id":"ASM-DEMO-001","requirement_assessment_id":"REQ-C05-002","question_id":"Q-C05-002","status":"DRAFT","disposition":"PENDING","condition":"Required evidence has not been accepted.","criteria":"The applicable requirement must be supported.","created_at":"2026-09-10T10:12:00Z"}
